{
  "profile_version": 1,
  "project_id": "lumeos",
  "display_name": "LumeOS",
  "profile_kind": "active",
  "active": true,
  "repo_root": "D:/GitHub/LumeOS-Claude-V1",
  "governance_root": "system",
  "specs_root": "docs/specs",
  "workorders_root": "system/workorders",
  "reports_root": "system/reports",
  "memory_root": "system/memory",
  "learning_root": "docs/project/governance-learning",
  "runtime_state_root": "system/state",
  "approval_root": "system/approval",
  "raw_data_paths": [
    "docs/specs/Nutrition/00_raw/"
  ],
  "ignored_local_paths": [
    "docs/specs/Nutrition/00_raw/",
    "system/reports/codex-worker/"
  ],
  "product_gate": {
    "status": "closed",
    "reason": "Product work remains blocked unless Tom explicitly opens it. BLS/Nutrition import execution remains blocked.",
    "conditional_planning_allowed": false,
    "execution_batch_allowlist": [
      "system/workorders/nutrition/batches/BATCH-NUTRITION-P1-005-SOURCE-CHAIN-READINESS.md",
      "system/workorders/nutrition/batches/BATCH-NUTRITION-P1-005-IMPORT-PREPARATION.md",
      "system/workorders/nutrition/batches/BATCH-NUTRITION-P1-005-SCHEMA-FOUNDATION-DRAFT.md",
      "system/workorders/nutrition/batches/BATCH-NUTRITION-P1-005-SEED-CANDIDATE.md",
      "system/workorders/nutrition/batches/BATCH-NUTRITION-P1-005-LOCAL-DETAIL-PANEL.md",
      "system/workorders/nutrition/batches/BATCH-NUTRITION-P1-005-LOCAL-DETAIL-DEEPLINK.md",
      "system/workorders/nutrition/batches/BATCH-NUTRITION-P1-005-LOCAL-PIN-COMPARE.md",
      "system/workorders/nutrition/batches/BATCH-NUTRITION-P1-005-LOCAL-COPY-LINK.md",
      "system/workorders/nutrition/batches/BATCH-NUTRITION-P1-005-LOCAL-RDA-FILTER.md",
      "system/workorders/nutrition/batches/BATCH-NUTRITION-P1-005-LOCAL-FOOD-FOUNDATION.md",
      "system/workorders/nutrition/batches/BATCH-NUTRITION-P1-005-LOCAL-FOOD-SAMPLE-STAGING.md",
      "system/workorders/nutrition/batches/BATCH-NUTRITION-P1-005-LOCAL-BLS-IMPORT-EXPANSION.md",
      "system/workorders/nutrition/batches/BATCH-NUTRITION-P1-005-LOCAL-FOOD-SEARCH.md",
      "system/workorders/nutrition/batches/BATCH-NUTRITION-P1-005-LOCAL-FOOD-HUMAN-LAYER.md",
      "system/workorders/nutrition/batches/BATCH-NUTRITION-P1-005-LOCAL-FOOD-SEARCH-HARDENING.md",
      "system/workorders/nutrition/batches/BATCH-NUTRITION-P1-005-LOCAL-PREFERENCES-CURATION.md",
      "system/workorders/nutrition/batches/BATCH-NUTRITION-P1-005-LOCAL-PREFERENCE-PREVIEW-CURATION.md",
      "system/workorders/nutrition/batches/BATCH-NUTRITION-P1-005-LOCAL-CURATION-PREFERENCE-HARDENING.md",
      "system/workorders/nutrition/batches/BATCH-NUTRITION-P1-005-HUMAN-LAYER-GAP-ANALYSIS.md",
      "system/workorders/nutrition/batches/BATCH-NUTRITION-P1-005-HUMAN-LAYER-V2-WILD-APPLY.md",
      "system/workorders/nutrition/batches/BATCH-GOVERNANCE-P1-017-system-tree-audit.md",
      "system/workorders/nutrition/batches/BATCH-GOVERNANCE-P1-018-system-tree-readmes.md",
      "system/workorders/nutrition/batches/BATCH-GOVERNANCE-P1-019-governance-core-phase-0.md"
    ]
  },
  "forbidden_paths": [
    ".env",
    ".env.*",
    "system/state/runtime_state.json",
    "system/state/*.lock",
    "system/approval/queue.json",
    "docs/specs/Nutrition/00_raw/**"
  ],
  "forbidden_commands": [
    "supabase db reset",
    "supabase db push",
    "supabase db push --linked",
    "supabase migration up",
    "migration execution"
  ],
  "required_checkers": [
    "governance-invariant-check",
    "agent-contract-check",
    "model-runtime-check",
    "governance-learning-check"
  ],
  "default_operator_batch": "system/workorders/nutrition/batches/BATCH-GOVERNANCE-P1-001-batch-loader-cli.md",
  "default_governance_batch": "system/workorders/nutrition/batches/BATCH-GOVERNANCE-P1-001-batch-loader-cli.md",
  "default_branch_prefix": "goal/",
  "source_chain_policy": {
    "module_index_required": true,
    "nutrition_priority_required": true,
    "raw_sources_require_explicit_allow": true
  },
  "allowed_domain_paths": [
    "docs/specs/Nutrition/",
    "docs/project/",
    "system/workorders/"
  ],
  "runtime_policy": {
    "require_live_hardware": false,
    "planned_hardware_maintenance_allowed": true
  },
  "docs_entrypoints": [
    "docs/specs/Nutrition/INDEX.md",
    "docs/project/CURRENT_GOVERNANCE_HANDOVER.md",
    "docs/project/PROJECT_PROFILES.md"
  ],
  "ui_settings": {
    "selectable": true,
    "default_profile": true
  },
  "promotion_policy": {
    "require_clean_worktree": true,
    "block_runtime_artifacts": true,
    "block_raw_local_data": true,
    "require_typecheck": true
  },
  "codex_worker_policy": {
    "enabled": true,
    "allowed_agents": [
      "senior-coding-agent",
      "senior-reviewer-agent"
    ],
    "require_explicit_workorder_flag": true,
    "default_timeout_ms": 120000
  }
}
