{
  "profile_version": 2,
  "project_id": "fixture-beauty-club",
  "display_name": "Beauty Club Fixture",
  "profile_kind": "fixture",
  "active": false,
  "repo_root": ".",
  "governance_root": "system",
  "specs_root": "docs/specs",
  "workorders_root": "system/workorders",
  "reports_root": "system/reports",
  "memory_root": "system/memory",
  "learning_root": "docs/project/governance-learning",
  "runtime_state_root": "system/state",
  "approval_root": "system/approval",
  "raw_data_paths": [],
  "ignored_local_paths": [
    "system/reports/codex-worker/",
    "system/reports/model-runtime-history/"
  ],
  "product_gate": {
    "status": "closed",
    "reason": "Fixture profile only. Beauty Club product work is not active and remains blocked until Tom provides a real repository path and opens the project gate.",
    "conditional_planning_allowed": false
  },
  "forbidden_paths": [
    ".env",
    ".env.*",
    "system/state/runtime_state.json",
    "system/state/*.lock",
    "system/approval/queue.json",
    "supabase/**"
  ],
  "forbidden_commands": [
    "supabase db reset",
    "supabase db push",
    "supabase db push --linked",
    "supabase migration up",
    "migration execution",
    "approval grant"
  ],
  "required_checkers": [
    "governance-invariant-check",
    "agent-contract-check",
    "model-runtime-check",
    "governance-learning-check"
  ],
  "default_operator_batch": "system/workorders/fixture-beauty-club/batches/BATCH-fixture.md",
  "default_governance_batch": "system/workorders/fixture-beauty-club/batches/BATCH-fixture.md",
  "default_branch_prefix": "goal/",
  "source_chain_policy": {
    "module_index_required": true,
    "nutrition_priority_required": false,
    "raw_sources_require_explicit_allow": true
  },
  "allowed_domain_paths": [
    "docs/specs/BeautyClub/",
    "docs/project/",
    "system/workorders/fixture-beauty-club/"
  ],
  "runtime_policy": {
    "require_live_hardware": false,
    "live_endpoint_checks_required": false
  },
  "docs_entrypoints": [
    "docs/specs/BeautyClub/INDEX.md",
    "docs/project/PROJECT_PROFILES.md"
  ],
  "ui_settings": {
    "selectable": false,
    "label": "Beauty Club fixture",
    "notice": "Synthetic inactive fixture for profile portability tests only."
  },
  "promotion_policy": {
    "require_clean_worktree": true,
    "block_runtime_artifacts": true,
    "block_raw_local_data": true,
    "require_typecheck": true
  },
  "codex_worker_policy": {
    "enabled": false,
    "allowed_agents": [
      "senior-coding-agent",
      "senior-reviewer-agent"
    ],
    "require_explicit_workorder_flag": true,
    "default_timeout_ms": 120000
  }
}
